{
  "name": "Command Code for piwin",
  "description": "为 piwin 接入 Command Code 登录、Go/GOAT 模型访问、动态模型发现及配额查询命令。改编自 patlux/pi-commandcode-provider。",
  "owners": [
    "mimimaster"
  ],
  "repository": "https://github.com/mimimaster/piwin-commandcode-provider",
  "subdir": "piwin",
  "license": "MIT",
  "keywords": [
    "commandcode",
    "provider",
    "oauth",
    "models"
  ],
  "homepage": "https://github.com/mimimaster/piwin-commandcode-provider/tree/main/piwin",
  "versions": [
    {
      "version": "0.7.1-piwin.2",
      "commit": "5cb551d00217f4bd154de6e4f5eb1b0a43eda57c"
    },
    {
      "version": "0.7.1-piwin.1",
      "commit": "8ff038e7cb425d2210abfeebef9bfc2f6e6e66ad"
    }
  ]
}
