{
  "name": "Claude Code",
  "description": "通过已安装的扩展在 piwin 中运行本机 Claude Code。产物是自包含适配器，不包含 Claude CLI。",
  "owners": [
    "mimimaster"
  ],
  "repository": "https://github.com/mimimaster/piwin-claude-code-backend",
  "license": "MIT",
  "keywords": [
    "claude",
    "claude-code",
    "session",
    "backend"
  ],
  "homepage": "https://github.com/mimimaster/piwin-claude-code-backend",
  "versions": [
    {
      "version": "0.1.0",
      "commit": "e2d831960780510d87e09bd7e61b250fd74499f3"
    }
  ]
}
