{
  "name": "Session Importer for piwin",
  "description": "提供交互式界面，支持从 Claude Code、Cursor、Codex 和 OpenCode 导入并恢复历史对话会话。",
  "owners": [
    "mimimaster"
  ],
  "repository": "https://github.com/mimimaster/piwin-session-importer",
  "license": "MIT",
  "keywords": [
    "session",
    "import",
    "claude",
    "cursor",
    "codex"
  ],
  "homepage": "https://github.com/mimimaster/piwin-session-importer",
  "versions": [
    {
      "version": "0.1.0",
      "commit": "460c8cf7ea52a32f0366cbd8cd6661e53eb6deb0"
    }
  ]
}
